{
  "$schema": "http://json-schema.org/draft-07/schema#",
  "$id": "https://agentrun.ai/schema/demo.schema.json",
  "title": "AgentRun demo (demo.json)",
  "$comment": "A demo's demo.json: the DemoSpec (demo-spec.schema.json, generated from its type in @parcha/agentrun-pi/signin) and the demo template's own fields. Every field is listed, so a misspelt one is refused. scripts/demo-schema.test.mjs validates every examples/*/demo.json against it.",
  "allOf": [{ "$ref": "https://agentrun.ai/schema/demo-spec.schema.json" }],
  "type": "object",
  "additionalProperties": false,
  "properties": {
    "name": true, "models": true, "keys": true, "programs": true, "packages": true, "expectedCalls": true, "expectedCost": true,
    "title": { "description": "The gallery card: 2 to 5 words.", "type": "string", "pattern": "^\\S+( \\S+){1,4}$" },
    "claim": { "description": "One line: what the agent does and the hard thing it survives.", "type": "string", "pattern": "^[^\\n]+$" },
    "targets": { "description": "Where the demo runs: hosted only when every tool has a hosted source.", "enum": [["local"], ["local", "hosted"]] },
    "kill": {
      "description": "The template's single kill, at the first crossing of point; `kills` is the list, for n, target, where and the rest (examples/reference/demo-spec.ts keeps only point and why here).",
      "type": "object", "additionalProperties": false, "required": ["point", "why"],
      "properties": { "point": { "type": "string", "minLength": 1 }, "why": { "type": "string", "minLength": 1 } }
    },
    "kills": { "description": "What --kill does: each entry in order, one per process (examples/reference/demo-spec.ts).", "type": "array", "items": { "oneOf": [{ "$ref": "#/definitions/crossingKill" }, { "$ref": "#/definitions/stormKill" }] } },
    "panels": { "description": "The viewer's own panel ids the recording draws.", "type": "array", "uniqueItems": true, "items": { "enum": ["disk", "lines", "pi-turns", "transport", "vision", "workflow-map"] } },
    "tools": {
      "description": "The job's tools that are code of its own: where each runs locally, and the hosted executor tool it is granted (null when none).",
      "type": "array",
      "items": { "type": "object", "additionalProperties": false, "required": ["name", "local"], "properties": { "name": { "type": "string", "minLength": 1 }, "local": { "type": "string", "minLength": 1 }, "hosted": { "type": ["string", "null"] } } }
    },
    "input": {
      "description": "The job's input for --input: what it looks like, its default, and named variants.",
      "type": "object", "additionalProperties": false,
      "properties": {
        "flag": { "const": "--input" }, "shape": { "type": "string" }, "default": {}, "variants": { "type": "object" },
        "fixtures": {
          "description": "The captures --input may name: each a name, and its fixture under the demo's fixtures/.",
          "type": "object", "propertyNames": { "pattern": "^[a-z0-9][a-z0-9-]*$" },
          "additionalProperties": { "type": "string", "pattern": "^examples/[^/]+/fixtures/[^/].*$" }
        }
      }
    },
    "sources": {
      "description": "The checked files the job reads (examples/reference/demo-spec.ts): true for the sources.json beside the demo, or a path to one, from the repository when it starts with examples/ and else from the demo's directory.",
      "oneOf": [{ "type": "boolean" }, { "type": "string", "pattern": "^(?!/)(?!(?:.*/)?\\.\\.(?:/|$))[^\\n]+\\.json$" }]
    },
    "browser": { "description": "false: the demo opens no page, so the entry creates no browser, live or on fakes. Default: a browser.", "type": "boolean" },
    "codeMode": {
      "description": "Code mode: a code tool whose sandbox has tools.bash and vision.see. Off by default.",
      "oneOf": [{ "type": "boolean" }, { "type": "object", "additionalProperties": false, "properties": { "timeoutMs": { "type": "number", "exclusiveMinimum": 0 }, "outputChars": { "type": "integer", "minimum": 1 } } }]
    },
    "sites": {
      "description": "The sites the agent can hand a task to (use_website): each runs a child agent in a browser of its own, starting at startUrl.",
      "type": "object",
      "additionalProperties": {
        "type": "object", "additionalProperties": false, "required": ["title", "description", "startUrl"],
        "properties": { "title": { "type": "string", "minLength": 1 }, "description": { "type": "string", "minLength": 1 }, "startUrl": { "type": "string", "pattern": "^https?://[^\\s]+$" } }
      }
    },
    "boxes": {
      "description": "The box the job's tools run in (examples/reference/demo-spec.ts).",
      "type": "object", "additionalProperties": false, "required": ["kind"],
      "properties": { "kind": { "enum": ["local", "docker"] }, "image": { "type": "string", "minLength": 1 }, "runIn": { "type": "boolean" } }
    }
  },
  "if": { "required": ["targets"], "properties": { "targets": { "type": "array", "contains": { "const": "hosted" } } } },
  "then": { "properties": { "tools": { "type": "array", "items": { "type": "object", "required": ["hosted"], "properties": { "hosted": { "type": "string" } } } } } },
  "definitions": {
    "crossingKill": {
      "description": "A kill at the nth time the child takes a named crossing.",
      "type": "object", "additionalProperties": false, "required": ["point", "why"],
      "properties": {
        "point": { "type": "string", "minLength": 1 }, "why": { "type": "string", "minLength": 1 },
        "kind": { "enum": ["process", "box"] }, "target": { "enum": ["run", "tool"] }, "n": { "type": "integer", "minimum": 1 },
        "hold": { "description": "At a crossing that parks (vision.filing): the kill waits until this many filings are parked, or waitMs has passed.", "type": "integer", "minimum": 1 },
        "waitMs": { "description": "How long a parking crossing waits for hold filings (default 3000).", "type": "number", "minimum": 0 },
        "where": {
          "description": "Only a crossing whose info has these values counts (announced through cross(point, { info })); with n, the nth matching crossing. A storm has none.",
          "type": "object", "minProperties": 1, "additionalProperties": { "type": ["string", "number", "boolean"] }
        }
      }
    },
    "stormKill": {
      "description": "kills kills, each at the first crossing taken once gapMs has run.",
      "type": "object", "additionalProperties": false, "required": ["storm"],
      "properties": {
        "storm": { "type": "object", "additionalProperties": false, "required": ["kills", "gapMs"], "properties": { "kills": { "type": "integer", "minimum": 1 }, "gapMs": { "type": "number", "minimum": 0 } } },
        "kind": { "enum": ["process", "box"] }
      }
    }
  }
}
